topic_id,topic_theme,consumer_type,consumer_scene
0,Gourmet Tasting Focus,1,"Business Fine Dining (Elegant, Secure, Executive Atmosphere)"
1,Sophisticated Fusion Cuisine,3,"Romantic & Intimate Dining (Calm, Private, Ambience-Focused)"
2,Seafood-Centric Artistry,4,"Gourmet Exploration (Curated, Inventive, Detail-Oriented Culinary Experiences)"
3,Contemporary Dining with MeatSpecialties,3,"Romantic & Intimate Dining (Calm, Private, Ambience-Focused)"
4,Authentic Korean & Asian Flavors,4,"Gourmet Exploration (Curated, Inventive, Detail-Oriented Culinary Experiences)"
5,Lively Casual Fine Dining,2,"Social Dining with Friends (Lively, Relaxed, Fun)"
6,Grill & Interactive Dining,2,"Social Dining with Friends (Lively, Relaxed, Fun)"
7,Masterful Culinary Innovation,1,"Business Fine Dining (Elegant, Secure, Executive Atmosphere)"
